toxicity,severe_toxicity,obscene,threat,insult,identity_attack,text
0.05300923436880112,0.0001274367532460019,0.0008436907664872706,0.00039207207737490535,0.0022592570167034864,0.0007337917340919375,"You're a real person, you know? He's a real man, and he's willing to do whatever it takes to protect his people.""

Trump went so far as to call China's currency manipulation a ""disgrace"" to the"
0.04427286982536316,0.00011795789032476023,0.0008920297841541469,0.00035500311059877276,0.002943231025710702,0.00042299003689549863,"You're a real man,"" he said.

""No I'm not,"" said the man. ""You were right.""

The police officer replied, ""You must be a real man.""

""You're a real man!"""
0.00426167156547308,9.077841241378337e-05,0.00029677170095965266,0.0001499734935350716,0.0003170508425682783,0.0001857492607086897,"You're a real man."" And in the words of one reporter:

It's not just that I love to be on TV … I also love to wear my suit and tie …

There are two ways to view that story: in"
0.010257480666041374,9.533561387797818e-05,0.0003529326932039112,0.00019108208653051406,0.0005935322260484099,0.00025715891388244927,"You're a real artist. And there's no one on earth to make you feel that. But you can never get more beautiful than when you work together.""

""So now we're working for you and we'll put that to good use"
0.0010144085390493274,0.00010276328976033255,0.00017019877850543708,0.00012788984167855233,0.00019909143156837672,0.00014016221393831074,"You're a real-life guy and it was my first experience of this business and I think I'd never seen anything like it before.

You're still interested in being a successful entrepreneur, but is that all there is?

Well"
0.0038485683035105467,8.965034794528037e-05,0.0002559810527600348,0.00013140880037099123,0.0002885384892579168,0.00019291533681098372,"You're a realist,"" and he just wanted to get my attention. I said, ""Well, if I was a realist then I'd love to talk about science with you.""

He was like, ""I'm sorry about that"
0.02331160381436348,9.001270518638194e-05,0.0005370201542973518,0.0001733731187414378,0.001411591307260096,0.00032972273766063154,"You're a real-life baseball player and you're playing shortstop, you're trying to make something of yourself that makes you think about playing shortstop in your 20s.""

""You're not that kind of guy, Babe Ruth and John L"
0.01685365103185177,9.315081115346402e-05,0.00041885636164806783,0.00019414964481256902,0.0008053749916143715,0.0003151522541884333,"You're a realist. Don't you wish you could say something else, like you're a philosopher, or you're a philosopher?

You know, I've been saying for a long time. ""We are not so rational that we"
0.9560571312904358,0.022130897268652916,0.7309461236000061,0.0007815794670023024,0.8901930451393127,0.011012204922735691,"You're a real jerk,"" he told the Times."
0.539276659488678,0.0004716538533102721,0.005951821804046631,0.001953801838681102,0.07610722631216049,0.002123346086591482,You're a real human being. So don't let that drive you crazy.
0.007979176007211208,7.968790305312723e-05,0.00031295130611397326,0.00012660778884310275,0.0004950982984155416,0.00019911838171537966,"You're a real estate agent, but you do business on a business model you're a marketing agent, you make an appearance as a real estate agent and you're not taking the responsibility of selling land on an ordinary basis.

So what you"
0.006271956022828817,0.00010386441863374785,0.0004647786554414779,0.0001648661564104259,0.00034866674104705453,0.00022293631627690047,You're a real smart person. Just ask me about a year ago when I found out I was HIV positive. I've never been sick before; I've been a virgin. I have to be with someone when the HIV virus makes the difference between
0.0010565902339294553,0.00010091482545249164,0.00019023929780814797,0.00010876625310629606,0.00019167277787346393,0.00014005237608216703,You're a real deal on a Saturday night. You could just look at the crowd of millions of people and feel the power of that moment.
0.10789116472005844,0.0001702606095932424,0.002450705971568823,0.00037658438668586314,0.008372155949473381,0.000699649506714195,"You're a real man when you're with a guy!""

That's what it looks like when his parents are with a woman or a group of men who are together.

""Your dad has been there all along. He'll tell"
0.03338246047496796,0.00011507561430335045,0.0006626730901189148,0.00020222776220180094,0.002589697018265724,0.0004069048154633492,"You're a real, grown up guy with a little sense of humor"" and a guy who doesn't know how to talk to a man.

If you were to buy a house and you were like, ""I think I know how to"
0.021732736378908157,0.00011049037129851058,0.0006330801988951862,0.0003191832220181823,0.0008594876271672547,0.00033606207580305636,"You're a realist,"" I said, sitting next to her. ""You're serious. I'm serious that we live together. I'm serious. This is our home. It's the only home we ever use. You see me as someone"
0.06055809557437897,0.00012330507161095738,0.0010605191346257925,0.0004083316889591515,0.002766235265880823,0.0005125262541696429,"You're a real person, you can't give up. That's a dream come true.""

He wasn't the first politician to publicly apologize.

Former Governor John Kasich in 2012 said his ""disgusting"" comments came when he"
0.0062882122583687305,0.00010346840281272307,0.00036068199551664293,0.00021452373766805977,0.00036972371162846684,0.00022817487479187548,"You're a real man, right?""

""I am. I'm not just the one with the white hat. I'm the one wearing a bulletproof vest and no tie. You don't have to come with me on this trip."""
0.9721296429634094,0.05626021698117256,0.8834851980209351,0.004383901599794626,0.8467340469360352,0.10731897503137589,"You're a real asshole and you're on trial for the day that people ask for your money?""

""That's right."" Harry said, pointing at me. ""I know you like all things black/But I'm only going to say"
0.0029641883447766304,8.687858644407243e-05,0.00017744371143635362,0.00012457554112188518,0.00029303375049494207,0.00019191122555639595,"You're a real artist. And so you're learning how to draw."""
0.9758595824241638,0.04242970421910286,0.8946123123168945,0.005356739740818739,0.8384472131729126,0.010607182048261166,"You're a real bitch of a fighter.""

""Yeah,"" I told her.

""So, you're going to be my friend for life, aren't you?""

""You're going to be my friend.""

"
0.014683985151350498,0.00010810252570081502,0.0003420354041736573,0.00019682137644849718,0.0009562356281094253,0.0004354860866442323,"You're a real person, that's all,"" She said to the children.

When a group of women from the mosque interrupted the speech, all of them fled.

But some people who knew her or spoke to her told the Tribune"
0.0009946583304554224,0.00011793077283073217,0.00020106148440390825,0.0001520663790870458,0.00018688962154556066,0.000157206755829975,"You're a real good guy, I love you. Please don't talk like this, because I know you're not going to like that. I don't know you want to say that. You're not the sort of person that will get along"
0.001684082206338644,9.908420906867832e-05,0.00021931905939709395,0.00010896774620050564,0.0002611051604617387,0.0001586216822033748,"You're a real genius!""

""Ahh, good! Thanks again.""

Sis now holding Siby, the small girl with the most beautiful face.

""It was so wonderful. It was wonderful in the way"
0.04089301452040672,0.00010987897985614836,0.0008173863170668483,0.0002480526454746723,0.0024955205153673887,0.00046258242218755186,"You're a real hard sell. They want you and the kids' money and you want their money, so I just don't buy into that.""

Heather Smith's new film, ""Criminal Minds,"" explores both the power of"
0.0024870536290109158,8.997571421787143e-05,0.00020775846496690065,0.00013031184789724648,0.000262444926192984,0.00016619717644061893,"You're a real, real person and a real person has no idea what I am.""

Her own experience in the United States was similarly troubling. When she was 19, she was sent to New York, where, she recalls, she was"
0.3107249438762665,0.0003110769612248987,0.003683140967041254,0.0010283015435561538,0.03109136037528515,0.0035301800817251205,"You're a realist!"" She yelled, glancing at Yang with her broad, black eyes and grim expression, ""And if that didn't make you mad, then this isn't a problem for you, isn't it?!""

She sighed"
0.9712536334991455,0.04117914289236069,0.8779765963554382,0.0013596208300441504,0.889924943447113,0.017678340896964073,"You're a real bitch,"" said Ryan, gesturing over a black wall of paper. ""There's nothing to protect from the wind.""

""You know you don't want them to know,"" said the bartender, ""but your friends and"
0.17529986798763275,0.00021653578733094037,0.003824040526524186,0.0006559172761626542,0.011979963630437851,0.0007878337637521327,"You're a real woman and I'm the one who is taking care of your needs, right?"" She giggled as she said this. It was her husband's decision whether she should accept this or not. I was dumbstruck at her and"
0.0010879796463996172,9.998445602832362e-05,0.00018103430920746177,0.00011491376062622294,0.00019722922297660261,0.00014878455840516835,"You're a realist, right? Thats how you know about realism, right?"" She said with a hint of bitterness. ""Right.""

After that, we spoke. ""We'll talk about it in a couple weeks,"" Z"
0.000568602466955781,0.00013579928781837225,0.00019597662321757525,0.00014802846999373287,0.00018115104467142373,0.0001479766797274351,"You're a real gentleman. I've made lots of friends, I respect you."""
0.061644040048122406,0.0001373276609228924,0.0009318063966929913,0.0005532852374017239,0.003230463247746229,0.0005561296711675823,"You're a real person. No, they weren't born this way. I'm not here to make you feel bad. I'm here to let you see.""

I had to put on a grin. That was how you learned to control"
0.19545215368270874,0.00019428410450927913,0.002797479508444667,0.0003665654512587935,0.02176746539771557,0.0009464392787776887,"You're a real woman.""

""Well, I guess not."""
0.002123010577633977,9.623575169825926e-05,0.00024089537328109145,0.00011928889580303803,0.00024860052508302033,0.0001581806573085487,"You're a real genius!"" she shouted to himself as he stepped forward to meet her. ""This is it! Oh my gosh!"" He had been waiting patiently for him to finish his last mission, but had only a short burst.

"
0.0006635098252445459,0.00012344776769168675,0.00018076004926115274,0.0001395451690768823,0.00018008962797466666,0.00014494085917249322,"You're a real, genuine person.

If you were in a restaurant with me for five years and I could see the difference, well then I've got my reasons, so I'm going to keep it simple for a long time and give"
0.0843350738286972,0.00029332670965231955,0.009043330326676369,0.00047703171730972826,0.00238372222520411,0.00039061580901034176,"You're a real deal!"" ""Oh, God. Is that so sweet?"" ""Oh, yes. I just… I was just thinking that I'd have to try and tell people that we got married.""

Then I started freaking out."
0.9838839173316956,0.034210365265607834,0.7467464208602905,0.0011623367900028825,0.9484976530075073,0.012891740538179874,"You're a real idiot."""
0.0005771302385255694,0.00013326146290637553,0.00017658797150943428,0.0001508874847786501,0.0001837453164625913,0.0001478043559473008,"You're a real good listener, and your thoughts always go into the next piece of this puzzle you solved a few months ago.

As a reminder, each piece you solve in this series will be highlighted based on how you played them.
"
0.0008813717868179083,0.00010612605547066778,0.00016619448433630168,0.00012464469182305038,0.0001956603373400867,0.00013928620319347829,"You're a real-life artist, too,"" she explained. ""I don't need the same kind of training I had before."""
0.9174549579620361,0.017606550827622414,0.8048153519630432,0.0011342797661200166,0.7178157567977905,0.007404906675219536,"You're a real man, not just an asshole. I'm trying to help you. You can't win. You need a man with a mind to take the next step. That's not who you are.""

""I won't tell"
0.0006941367755644023,0.00011859579535666853,0.00017801379726734012,0.00013286939065437764,0.00016865019279066473,0.00014181768347043544,You're a real hard-core fan of the idea. Maybe I would have been nicer to do this if it came about in a more positive light. But the truth is this: this isn't a game I like making. I think this is
0.9607139229774475,0.020754927769303322,0.8562005758285522,0.00143575354013592,0.3058514893054962,0.0028376062400639057,"You're a real girl. You know that shit. So you want to be with us.""

In front of him, she stood up and got off the bus and then back in the van. ""Don't tell anyone. We're never"
0.0012660289648920298,9.81476841843687e-05,0.0001850786793511361,0.00011134612577734515,0.0002083289436995983,0.00014917977387085557,"You're a real genius. I can understand that. You have been so good with your work. Your talents are contagious. You think this is so hard.""

""It is. It was, but…"" Her face darkened. ""It wasn"
0.0005751944845542312,0.00012808902829419822,0.00017662702884990722,0.00013676639355253428,0.00018162545165978372,0.00014640853623859584,"You're a real good coach, so you have my blessing.""

Gonzalez said he thinks the Dodgers would have liked the trade for Yasiel Puig and Jorge Posada. Gonzalez pointed to Gonzalez' strong performances in the postseason last year"
0.001023389515466988,0.00010296329128323123,0.0001765415072441101,0.00012390546908136457,0.00019637166406027973,0.00014176346303429455,"You're a real hard worker, I guess,"" she said. ""I don't think I've ever done anything like this."""
0.001017980044707656,0.00010220556578133255,0.00017815134197007865,0.00011859997175633907,0.00018254700989928097,0.00014381583605427295,"You're a real journalist. I've got no problem at all with that. I'd love to do a full piece on that.""

In addition to The Post, the Daily Beast reported on a number of other recent cases of media bias against"
0.0024512505624443293,0.00012740466627292335,0.00027680397033691406,0.00022742620785720646,0.0002450428728479892,0.00021531597303692251,"You're a real hero.

But this is my story. I need to live this dream. I want to be in New York for two years. I want to be back in this life in five years. I want to be the best"
0.04282667115330696,0.0001687980256974697,0.0009057351271621883,0.0009547199006192386,0.0021251006983220577,0.0006068317452445626,"You're a real person... and you should be in my shoes! So what's your plan for this year?""

""Well, I want to go for a run, and we need to go a little bit early. I want to go"
0.002248127479106188,8.928204624680802e-05,0.0002036150253843516,0.00011900508980033919,0.00024376381770707667,0.00016620448150206357,"You're a real professional and you work for a company that has to make money for you.""

According to a lawsuit, Perez was trying to obtain legal advice about how to become president so she could help the bank hire a board member who could"
0.8859424591064453,0.01070953905582428,0.5839603543281555,0.0008190333028323948,0.775967538356781,0.008647987619042397,"You're a real jerk.""

I sighed. ""I'm sure that doesn't bother you.""

""What if you get into an argument with someone who hasn't even met your standards?"" Harry asked me in a tone of concern."
0.0031697931699454784,8.609484939370304e-05,0.00022043728677090257,0.00011620642908383161,0.00027715018950402737,0.0001862985809566453,"You're a real artist,"" said L.A. Mayor Antonio Villaraigosa.

Villaraigosa spoke about ""stereotypes and stereotypes,"" adding: ""I'll never condone this. It's not fair.""

He"
0.5905024409294128,0.004217133391648531,0.05583275482058525,0.0026888202410191298,0.22182685136795044,0.14257875084877014,"You're a real boy, your mom's an Indian girl. What a privilege to have you in here.

Your mom: No matter what.

Dude: What happened? What did you do?

Mom: Just walked"
0.01510273665189743,9.98095638351515e-05,0.000608398811891675,0.00024093191314022988,0.0007285959436558187,0.0002519447007216513,"You're a real man, so you understand it. And I think they're right.

Q: What kind of a man you are?

A: I'm a man, I guess? It was really hard for me to come"
0.001357999979518354,0.00010692486830521375,0.00019060696649830788,0.00014702141925226897,0.00021102686878293753,0.00016439019236713648,"You're a real person. I just want to be a better leader. Maybe I'll have more time in this job, but I want to focus on being better for all of us."""
0.9946428537368774,0.25309619307518005,0.9385898113250732,0.5019794702529907,0.8777472972869873,0.04332488775253296,"You're a real bitch. You could probably have kicked me.""

""You think I'm the only one in here with a gun?""

""Maybe. Maybe I would have shot you if you asked.""

""No, I"
0.006240102928131819,0.00010282563744112849,0.0003701589012052864,0.00019691447960212827,0.00043451099190860987,0.00021438082330860198,"You're a real boy and I'm a real girl."" He smiled at her. ""We both do. It's so natural, I don't think anybody will ever hear it."" She nodded. Then she turned back to the chair in front of"
0.8622063398361206,0.005680857226252556,0.03540630638599396,0.12917913496494293,0.20115776360034943,0.008045108988881111,"You're a real loser and he's trying to win you back, but he can't. You were good to me. I was good. I was bad. You're going to beat him over and over and over again. Stop asking and listen"
0.678356409072876,0.012313184328377247,0.018504848703742027,0.5292501449584961,0.04226977005600929,0.022417215630412102,"You're a real guy, you should have a gun if ever you have to and now you're on the other side of that line, the guy who said you're going to get shot,"" Sanders said in an interview at the NRA rally Wednesday night"
0.008412930183112621,8.792816515779123e-05,0.00032353700953535736,0.00014989242481533438,0.0005069158505648375,0.00023248879006132483,"You're a realist"" — and so can you. You want to be a good writer with a good sense of humor. And if you have that, you have a job. In my book, I've used the ""theoretical"""
0.08448565006256104,0.00022465185611508787,0.0009607903193682432,0.0015596159501001239,0.0036017820239067078,0.0009399035479873419,"You're a real girl, and you think that will stop you from doing that? I think we should go and look for help.""

He grabbed her and wrapped her in a blanket.

""Don't touch,"" he insisted.
"
0.0009862816659733653,0.00011436139175202698,0.00019126235565636307,0.00014085581642575562,0.00018924479081761092,0.0001528630527900532,"You're a real guy, and I am trying to be a more successful guy...you know...in life I'm still thinking about myself after 30 years of being around people. And I feel very fortunate to be around so many very successful people and"
0.8642438054084778,0.009180992841720581,0.5588238835334778,0.001034143497236073,0.6872882843017578,0.00890404637902975,"You're a real world badass! Let's face it, most of you guys would never make it without me.

So, what else can we say? We just had a nice vacation on a rainy day and are feeling off to the races"
0.003318427363410592,9.04219486983493e-05,0.0002351894072489813,0.00010827244841493666,0.00033142141182906926,0.00020697271975222975,"You're a real good kid,"" a man tells her. ""Don't be afraid to call someone out on anything.""

He's only 20 and lives with three adult children, according to his mother.

But according to the Daily News"
0.017231550067663193,0.00014034449122846127,0.00044290273217484355,0.00022719908156432211,0.0012085686903446913,0.0010573716135695577,"You're a real American citizen, so you're born in this country. And, by the way, most of the people are refugees from Syria and we're not. We're immigrants from all over.""

On the campaign trail earlier this month"
0.0008757030009292066,0.00011090214684372768,0.00018303189426660538,0.0001291417720494792,0.00019197637448087335,0.00014497582742478698,"You're a real deal, you're a nice guy and I love you. Do you know how many times I've run into a girl in the street?""

The guy replied, ""She always keeps trying to take out the money for things"
0.0469873771071434,0.00014052740880288184,0.0010877304011955857,0.0005924933939240873,0.0015747067518532276,0.0004423006612341851,"You're a real person, but what do you do?""

""I'm a real person—but what do you do?""

""I'm not an angel.""

""What do you do?""

""You keep going"
0.0006278238142840564,0.00012049983342876658,0.00017982040299102664,0.00012139097816543654,0.00017311458941549063,0.00013926680549047887,"You're a real big fan of the movie that came out this summer, and in fact, I think, there was only one trailer released that got the attention and attention of the movie industry. That's actually how that trailer was created and released."""
0.005489768926054239,0.00010164223931496963,0.00029103385168127716,0.0001772306568454951,0.0003177828330080956,0.00024115575070027262,"You're a real world artist. You like writing poetry. You like singing. You like a lot of things. So how do you communicate your work to others?

I'm an illustrator. I like to make stuff. I like being"
0.00485039921477437,8.816467743599787e-05,0.00030068057822063565,0.00011598159471759573,0.0003653964668046683,0.00019159071962349117,"You're a real big kid (laughs). I was about 15 years old when I started college, and then I started doing the wrestling scene. I watched wrestling shows at 3am every night in the morning, and it was all about kids being able"
0.015255268663167953,9.677650086814538e-05,0.0006593889556825161,0.00021491682855412364,0.0007506117690354586,0.00022225121210794896,"You're a real person"" and that the only thing that matters is what I'm saying and not what I'm getting at in court? And in fact this just reminds me a lot of the conversations a lot of these guys had. [LAUGH"
0.026269249618053436,0.00010861628106795251,0.0005914729554206133,0.00035242331796325743,0.0013704780722036958,0.0002779893693514168,"You're a real person that really lives."""
0.010007243603467941,8.282807539217174e-05,0.0003441951412241906,0.00014930385805200785,0.0005563115119002759,0.0002178605500375852,"You're a real world professional, no one wants to see someone who can do the same."""
0.9159669876098633,0.00838869996368885,0.267467737197876,0.005722790956497192,0.6501473784446716,0.03596046194434166,"You're a real nerd and I want to make your pants bigger,' I said.

'You should feel better,' she said.

'Yes, I am,' I said.

'That's not very nice, is it"
0.12740197777748108,0.00021979509619995952,0.0037672764156013727,0.0008952589705586433,0.005842508282512426,0.0012913800310343504,"You're a real fighter. Don't make your man look bad.""

The following day, Johnson was sentenced to six years in prison for the sexual abuse of a minor.

Johnson, 24, was arrested in 2011 and later pleaded guilty"
0.004504213109612465,8.71889860718511e-05,0.0002416794013697654,0.00016059067274909467,0.0003645714605227113,0.00018566957442089915,"You're a real-life doctor, you have a very real life background, so your ability to be patient and patient, it can be really daunting.

How hard would that be?

I'm glad I had it, because I"
0.0011772217694669962,9.895182301988825e-05,0.00016742399020586163,0.0001304747274843976,0.0002208681544288993,0.00014525784354191273,"You're a real estate investor with an awesome experience, you might even be a member of the first team of Reddit.

Now let's take a look at some of the many ways you can get started learning to do a better job of building"
0.8986415863037109,0.002274058759212494,0.10388326644897461,0.0013702001888304949,0.4295276403427124,0.0038749014493077993,"You're a real bad liar!

""I don't mean to lie to you anymore. But I'm not going to be a liar. I mean to be a good liar. And I want to make it sound like I care about your"
0.03517147898674011,0.00010834122804226354,0.0007871208945289254,0.000257365929428488,0.0014947840245440602,0.0004115296178497374,"You're a realist!"" It was always fun, but in my head this guy always told me how much that made me laugh and that made me happy.

I was in high school, and I was the only child in class to have"
0.9912793040275574,0.09117648750543594,0.9431269764900208,0.001230057212524116,0.9235804677009583,0.04211033135652542,"You're a real asshole. When I was 10 years old, I was really sick of listening to people talk about how ""racist"" they were. I thought that I was crazy. It was like being a kid in Africa or something. It was"
0.9590517282485962,0.022286174818873405,0.8555877208709717,0.0008070874609984457,0.6476708054542542,0.005415505263954401,"You're a realist but you're a really fucking clever mathematician, so maybe you should learn something about geometry.""

""I'm just trying to understand it when I'm really serious about it and not thinking about it,"" she laughs.
"
0.0020282885525375605,9.040504664881155e-05,0.00019922775391023606,0.00012376660015434027,0.0002475059882272035,0.00015973241534084082,"You're a real life character and have no right to the rights to write what you want, so why bother if you can write better stuff?""

That's not the only common thread on both sides of the debate: people tend to associate being"
0.8999240398406982,0.012501802295446396,0.764828622341156,0.001918289577588439,0.20894713699817657,0.005588302854448557,"You're a real woman who was married. I'm married. I have two sons.""

""You know I'm a bit of a pussy as a woman. I try to get along with other women. You know you don't want to"
0.03918522968888283,0.00012391680502332747,0.0008153566741384566,0.0002562435402069241,0.0029174762312322855,0.0004664181615225971,"You're a real girl, right? And you look like you're really, really cute. You can really, really look, actually look beautiful.

I was thinking about my mom as a kid. I didn't go to school in a"
