toxicity,severe_toxicity,obscene,threat,insult,identity_attack,text
0.48393675684928894,0.0004403031198307872,0.003935829736292362,0.0009375610970892012,0.06435191631317139,0.01035093329846859,"You're a real person,"" he says. ""I think that what you hear from people who say you're a racist is the opposite of the truth; because you talk about things that are offensive and that are deeply damaging and horrible to people's feelings"
0.0034013157710433006,0.00010775394912343472,0.0003101568727288395,0.00013511137512978166,0.00031005428172647953,0.00020301173208281398,"You're a real good friend"" but then they had to ask their mom and dad for help. The two agreed they were going to let a stranger touch them, and he did.

They started getting serious. They could not do anything to"
0.010668216273188591,8.847907884046435e-05,0.00033687715767882764,0.00014052285405341536,0.0007515050237998366,0.00027473323279991746,"You're a real good guy. You're in your 20s,"" she told the audience.

But Sanders has been unable to bring himself to answer his own rhetorical questions about his health. Sanders's health woes come amid a bitter fight with rival"
0.9956865310668945,0.16915225982666016,0.9760086536407471,0.002042753156274557,0.9338340759277344,0.011948104947805405,"You're a real fucking badass,"" she said as she made a mental note to leave all the hate out until they both looked back. Ruby took a deep breath and sat back down on the couch. ""This is your moment, okay?""

"
0.9766547679901123,0.03851844742894173,0.8635113835334778,0.0009909567888826132,0.8863711953163147,0.01411227323114872,"You're a real jerk."" And she says, ""Well, I know I'm real jerk."" And she says, ""Well, I know you're real jerks."" And she says, ""Yeah, I know I'm real jerks."
0.05070452764630318,0.00015019932470750064,0.0007867376552894711,0.0008125021122395992,0.0024210175033658743,0.0005723329959437251,"You're a real life person, so why would you care about your own interests?"" ""I want to live, eat, drink… whatever makes me happy is what makes me happy,"" she added."
0.028278937563300133,9.882923768600449e-05,0.0007532329764217138,0.00021295981423463672,0.0015621224883943796,0.00031442748149856925,"You're a real professional. I've never done that before,"" he said.

Gone is the days of a professional sports agent being fired on the spot for a potential job offer.

But the reality is that if you're a"
0.7082881331443787,0.006252720952033997,0.0404537096619606,0.003390281228348613,0.19473671913146973,0.3455837666988373,"You're a real gentleman,"" he said.

He also admitted that there's a difference in how he and the girls feel about being gay.

""You're the one that makes me the most uncomfortable because of this behavior, you're"
0.9225351214408875,0.01514067966490984,0.6291040778160095,0.0008355519385077059,0.8417713642120361,0.011284997686743736,"You're a real jerk.""

This was the last thing the show needed on this night. The audience was waiting for them in the theater and at a theater, and at the theater's marquee they didn't hear anything at all, and they"
0.9835859537124634,0.058705490082502365,0.9187460541725159,0.0012813513167202473,0.9047549366950989,0.011759929358959198,"You're a real life human being. How could anyone that was so stupid as to say ""oh, that's really cool."" What a fucking moron that would be."" When one of them says something you have a hard time accepting it, it"
0.12000869959592819,0.00048138509737327695,0.016388867050409317,0.00033535363036207855,0.028599288314580917,0.0018005274469032884,"You're a real big shot,"" said Mr. Anderson, who spent more than a decade as his boss's lawyer.

Mr. Anderson said his client did not want to be charged with aggravated assault. A judge dismissed that charge against him in"
0.05104362964630127,0.00012349792814347893,0.0011308494722470641,0.00040328429895453155,0.002703817328438163,0.00047164689749479294,"You're a real man!"" – John Kerry

Kerry: No, you're not.

Warren Buffett: Just go with it!

Kerry: No, I think a lot of the stuff you hear about the media is"
0.0015372298657894135,9.592543938197196e-05,0.00017487650620751083,0.0001419812615495175,0.00022153885220177472,0.00015434468514285982,You're a real-life person and you've been through this and know something about life so hopefully you can help the next time you hear the name of Donald Trump. You know there have been many people who have come out because of him and they
0.6289679408073425,0.0047651734203100204,0.042554598301649094,0.002118872944265604,0.21053878962993622,0.2486351579427719,"You're a real bad coach.""

In fact, many of these men are, indeed, coaching in the same job as the head coaches who were the front-runners for the 2016 Republican presidential nomination last year. They're white, male,"
0.005571071524173021,0.00010631201439537108,0.0003091908583883196,0.0002174247638322413,0.0003727662842720747,0.00021895591635257006,"You're a real smart person."" She smiles and adds, ""That's not what I'm used to. You're going to have to learn some things, but the most important one is getting out of here.""

I think about the last"
0.5267874598503113,0.0009751520701684058,0.019202804192900658,0.0019160814117640257,0.20140475034713745,0.010579469613730907,"You're a real life criminal and it should be a red flag,"" he said. ""Because it's wrong of them to target a group that you care about.""

As a result, the law, which was passed on Feb. 13,"
0.0008528688922524452,0.00011078544775955379,0.00018106539209838957,0.0001262452860828489,0.00019614581833593547,0.00014539461699314415,"You're a real smart, smart, smart guy!""

The young man sighed. ""You are right. I have no idea how good you are.

""No one can tell how much more you can do. I don't know"
0.0026595464441925287,9.154644794762135e-05,0.00022547782282344997,0.0001322138268733397,0.0002682060294318944,0.00016927511023823172,"You're a real-life superhero, so you can't deny it.""

""I wouldn't let that on,"" said Foxx. She smiled at the fact that she had made such a big mistake. ""You said you were proud of"
0.007199542131274939,9.167144889943302e-05,0.00031347357435151935,0.00017136750102508813,0.0004944088286720216,0.0002420151577098295,"You're a real star to watch because of my smarts but I'm an animal to watch because of my temperament.""

""I like dogs more. People, I like their personality,"" Trump said at the event in Northamptonshire"
0.0018110693199560046,9.223720553563908e-05,0.00018380823894403875,0.0001062824230757542,0.000300364539725706,0.0001698728883638978,"You're a real good kid with this dream job,"" the lawyer said."
0.8288047313690186,0.020423388108611107,0.1335156410932541,0.008963570930063725,0.2559276223182678,0.6118510961532593,"You're a realist, right?"" says Dina. ""But why are you so concerned about black women? Black women are like the plague. It kills them, it ruins their lives.""

Dina laughs. ""But black women also"
0.6046410799026489,0.006516375113278627,0.027585722506046295,0.005135947838425636,0.08499116450548172,0.3887723684310913,"You're a real woman. You've got so many things you can work on.

I don't really want to talk about being a black, lesbian, gay, straight woman, but I just want to say we live in a society that"
0.03254589065909386,0.00012552901171147823,0.0008084722212515771,0.0005086379824206233,0.00143028749153018,0.0003944964555557817,"You're a real person. You want to know why I'm there. You want to know what was going through your head?""

Luna had one of the most exciting moments of her day. ""Oh, man.""

""How"
0.005286238621920347,0.000107008614577353,0.0005110934725962579,0.00015341209655161947,0.0003579638432711363,0.00017833862511906773,"You're a real deal. A real deal. Just like you and I.

And now, this is where I got really good at that part of my game, and you could say I'm a really good player because I didn't think"
0.1372009664773941,0.000155787929543294,0.0015819338150322437,0.000563490844797343,0.007015664130449295,0.0008508979808539152,"You're a realist, you want to put your heart, mind and body into something good, you never talk about it but you care about it.

Why would you want to do anything about it? What if you told your wife you"
0.0005640469607897103,0.00013471514103002846,0.00018698729400057346,0.0001521090161986649,0.00017395617032889277,0.00014471769100055099,"You're a real good friend of mine and I know this from my life experience,"" she tells PEOPLE. ""I feel like I'm a more authentic woman when I do something as mundane as this. I really like using a smartphone and interacting with people"
0.0038314934354275465,9.299549856223166e-05,0.00025410091620869935,0.000152195047121495,0.0002951430797111243,0.00018991180695593357,"You're a real hard worker. You don't have to think about what comes after that. That's why if you find something that interests you, you're going to try to find that specific benefit or service that you want. And you can't"
0.006699476391077042,0.00011235466809011996,0.0006022051675245166,0.0001336540444754064,0.000423618737841025,0.00024155917344614863,"You're a real nice guy,"" said the victim, whose condition quickly improved when she spoke to another woman about his sexual history.

The police said they do not believe a victim of this crime was aware that his conduct was being used against her"
0.037858836352825165,0.00010039192420663312,0.0005659222952090204,0.0002571885706856847,0.0017067441949620843,0.00043918282608501613,"You're a realist, and the fact that you write fiction is not a sign of integrity. This is a sign of an overindulgence in the way you tell a story. You want this to come true, you know?""

"
0.00719434954226017,8.449613233096898e-05,0.0003053818363696337,0.00015899738355074078,0.0004971961607225239,0.0001985412964131683,"You're a real-life actor who's seen the movie The Hunger Games. So you've got those things up your sleeves to be able to watch and enjoy your favorite stuff for the rest of your life."""
0.09586618840694427,0.00013882039638701826,0.0008025503484532237,0.0005571520887315273,0.005338065791875124,0.0006242917734198272,"You're a real person, but you're scared of rejection, and you've made your way through all the hurdles,"" he told me. ""Because you've never gotten the chance to prove yourself, and you've never gotten that chance to help others"
0.008232367224991322,8.76893536769785e-05,0.00041069622966460884,0.0001403546630172059,0.0006079258164390922,0.00020990610937587917,"You're a real star.""

Sue and Bobby had previously worked together on the new television sitcom ""Sons of Anarchy"" with Bill Hader."
0.005882094614207745,8.437704673269764e-05,0.00031533738365396857,0.00012901585432700813,0.00046251117601059377,0.00019545055693015456,"You're a real genius. I'm a bit lost in my head.""

Dumford paused to wonder if Harry had lost track of how many of the Quidditch matches he had lost during the tournament, whether he had missed too many"
0.9101278185844421,0.01591348461806774,0.5146633982658386,0.0016103604575619102,0.7961168885231018,0.0610588863492012,"You're a real jerk, right?

The fact of the matter is, everytime I see a female in a dress, I always assume she's a fat, short, thin guy. And every time a tall woman I know in her"
0.07326724380254745,0.00013611016038339585,0.001380471745505929,0.00035258158459328115,0.004539142362773418,0.0007404156494885683,"You're a real bad fit"" to the idea, according to The Wall Street Journal, the group's top lobbyist, Jack Goldsmith, said in an interview earlier this week.

""I think this could lead to some really bad unintended consequences"
0.9934630393981934,0.09475293010473251,0.9661010503768921,0.0020703726913779974,0.562022864818573,0.0034013078548014164,"You're a real, man... It's time for me to get fucked. Stop..."
0.12369619309902191,0.00015240648644976318,0.0013277295511215925,0.0003566764062270522,0.009328916668891907,0.000895469740498811,"You're a real geek, do you ever go to the movies and find out that it's all about the film?"" And she does. And she loves the music. She loves the movies. I do too. She loves the theater. She loves"
0.001859731855802238,8.768559200689197e-05,0.00020105994190089405,0.00010207514424109831,0.00024614998255856335,0.00014868713333271444,"You're a real-estate agent, you're pretty much a real-estate agent, and you do have a long way to go,"" he said.

But he said there is an ""urgent need"" for him to come up with"
0.007377611938863993,9.0392553829588e-05,0.0003614327288232744,0.00017217660206370056,0.0005118437693454325,0.00020337733440101147,"You're a real man. And this is true.""

Advertisement Continue reading the main story

Asked if he wished he had not come before an audience, Mr. Smith was quick to remind himself that his performance was a one-man show"
0.005389383528381586,9.280423546442762e-05,0.0003104899951722473,0.0001523951650597155,0.00035707358620129526,0.00022248273307923228,"You're a real guy, so let's go back to the drawing board. If only the Democrats could keep the party together, I'd be voting for the nominee. But if it looks like they're going to throw up a mess, I just"
0.0009966280777007341,0.00010202746489085257,0.0001779204758349806,0.00011549246846698225,0.00019391080422792584,0.00014529966574627906,"You're a real world lawyer. And I have a lot of respect for that."""
0.0025269505567848682,9.338953532278538e-05,0.00026418117340654135,0.00010751818626886234,0.00023768287792336196,0.00016209804743994027,"You're a real good guy."" --

""And so we are?""

""Yes, ma'am."" --

""So, if you could give a man a wife and a daughter, what could you give them?""
"
0.06886149942874908,0.000126567596453242,0.0006852519582025707,0.0003994818835053593,0.004254600964486599,0.000668332795612514,"You're a realist - you want to be an actor with a whole lot of soul and you always want to have it. But when you start to write, what happens is you get to be the most self-absorbed, the most intro"
0.8433563709259033,0.002934463554993272,0.0806306004524231,0.0012334923958405852,0.6703688502311707,0.015961330384016037,"You're a real nerd, dude, I'm gonna stick to sports for the life of me…just keep playing baseball."""
0.13297611474990845,0.0001783498446457088,0.0014772486174479127,0.0005837759817950428,0.005652632564306259,0.0023366049863398075,"You're a realist, I'm a Buddhist and I don't really like being bullied, but I did see some of these situations.""

Duterte says he was once bullied on social media: ""I did it because I didn't like"
0.0012028322089463472,0.00011859884398290887,0.00024641299387440085,0.00013506680261343718,0.00022520753554999828,0.00015929587243590504,"You're a real good girl. You are awesome... so excited to meet you!"" Elsa smiled wickedly. The moment Anna showed her how much she appreciated her ""excitement"" she became enthralled by Elsa's smile.

They were"
0.07088512182235718,0.00016314254025928676,0.0007055323221720755,0.0008009757148101926,0.006345346570014954,0.0009075393318198621,"You're a real life human and it would be better if we stopped calling people you love and we let you grow up knowing that you are a valued human being. That's what we want to do.

But I think that if we stop"
0.7408480048179626,0.001022591721266508,0.023296598345041275,0.00174239301122725,0.32607394456863403,0.0051423427648842335,"You're a real fighter, so stop acting like you're crazy!""

This tweet was from former Trump campaign CEO Corey Lewandowski on Tuesday night.

""If you really want to win the election, you're going to have to act"
0.0086229108273983,0.00010782261233543977,0.0007020171615295112,0.000169902850757353,0.0005454845959320664,0.00020527133892755955,"You're a real deal'!""

""Really?!""

""You know, they'd be outta the ballpark with a Yankees pennant tie.""

I smiled, as if I knew something. I'd never seen so many excited"
0.0007536842604167759,0.00011371491564204916,0.0001759227889124304,0.00012708241411019117,0.00017113970534410328,0.00014082211419008672,"You're a real big supporter of me on Tumblr and Instagram, so let me know if you've enjoyed the art in question

Check out the original artwork for the cover!"
0.07798730581998825,0.00025753723457455635,0.0008160998113453388,0.0006847780314274132,0.002391617279499769,0.005836382042616606,"You're a realist. I don't see how we could be more accepting of Christians.""

Lori Miller"
0.03537476062774658,0.0003486943314783275,0.0009275011834688485,0.004052953794598579,0.0017274200217798352,0.0010188153246417642,"You're a real hero to us, and we think you're a real kind of person to us. You're going to live with us for a while, because you're the only one with you, and you're willing to go through all of"
0.9973287582397461,0.44044068455696106,0.9808001518249512,0.21892927587032318,0.8856323957443237,0.025961853563785553,"You're a real girl, and I'll get your cock inside of me. That's my job, baby! MMMM. Oh fuck...your cock is such a big, tight whore. Mmmmmmm. Your mouth is so big,"
0.9932646751403809,0.13141366839408875,0.9696249961853027,0.00145947455894202,0.9214321970939636,0.010733000002801418,"You're a real fucking badass!""

Carpenter: ""Yeah, I'm not even THAT big-time!""

Ryan: ""You're pretty good. That's why you are here.""

(Ryan sits down with Carson"
0.0013761556474491954,0.00010360505257267505,0.00021699337230529636,0.00012587133096531034,0.00020410407159943134,0.0001460593775846064,"You're a real rockstar. Your songs sound amazing to me, and the only reason I like this album is because it made me feel like, well you're getting on that radar. This album made me feel like I could listen to all these"
0.06086098030209541,0.00017399099306203425,0.0014036421198397875,0.00041679496644064784,0.005368408747017384,0.002070742892101407,"You're a real black Belt for college football,"" said one high school graduate on Wednesday. ""If you're the best possible candidate, you can win. If you're the worst possible candidate, you can win."""
0.006173650734126568,8.597760461270809e-05,0.00030404055723920465,0.00015398718824144453,0.0005242009647190571,0.00019621876708697528,"You're a real person, you really are.""

Trump was in his early 60s at the time, according to several accounts of the encounter. He called the woman to congratulate her on her successful Senate bid and to ask her if she had"
0.02221144177019596,9.8014970717486e-05,0.00053310178918764,0.0002295279409736395,0.0013692615320906043,0.0002975834358949214,"You're a real boy, man."" -Rory Pearce"
0.000896096637006849,0.0001129609954659827,0.0001743606844684109,0.00014383859524969012,0.0001834388094721362,0.00014480990648735315,"You're a real person who does a great job with this and if you don't feel that love for me that you can always try to improve it, you're probably not a good listener. A great listener is someone who will listen, will give"
0.0236984770745039,0.00015591619012411684,0.0007202234119176865,0.0009110160171985626,0.0010827338555827737,0.00048625931958667934,"You're a real gamer. You're not going to get beat up in this video game.""

The game features a competitive shooter featuring four distinct weapon classes:

Misc.

Single player modes including:"
0.14232514798641205,0.00019291734497528523,0.0025611985474824905,0.0003956129075959325,0.017917463555932045,0.000942399085033685,"You're a real person,"" says the 30-year-old.

""I could have been a drug addict. So it wasn't going to be the worst.""

There have been many victims, but not one such one who had"
0.0009490330121479928,0.00011729510879376903,0.00020779333135578781,0.000139759955345653,0.000184365882887505,0.000155758680193685,"You're a real rock star. But I love this club because there's a lot of other bands out there that could have been better off here. We're lucky to have such a nice band here, they'll go to a great gig, we"
0.04145021364092827,0.00011655400157906115,0.00114541407674551,0.0002549347118474543,0.0026370487175881863,0.0004147588915657252,"You're a real person. I'm a mom and grandma. My dog is always home.""

There is a clear generational divide in the debate about gender identity and gender expression. People who identify with their parents, older siblings or single parents may"
0.0006102083716541529,0.00013582519022747874,0.00019320636056363583,0.00015416127280332148,0.000178128233528696,0.00015226950927171856,"You're a real good guy. And the only thing I can say is I love you,"" he told me. ""And I'm proud."" The pair agreed that it would be important for their relationship to take off in the near future, but the"
0.001079815672710538,0.00010862549970624968,0.0002329856506548822,0.00011370699940016493,0.00018626802193466574,0.00014020965318195522,"You're a real nice guy.""

This would have been the last thing he would ever mention. And I could argue with that. I mean, I just got it, too – and in fact, I just got it – and I'm"
0.021300122141838074,0.00014419975923374295,0.0006816546083427966,0.0005466067232191563,0.0009290135931223631,0.00043522147461771965,"You're a real, you're an artist. You got to put your hand on your heart, in the right place, and I'm saying that. I just want a world. So let's be real. Let's create an environment in which"
0.0006415997631847858,0.00012223192607052624,0.00016991712618619204,0.00013657065574079752,0.00017475865024607629,0.0001437890896340832,"You're a real fan of the game I would suggest trying it out and you could do a bit of customization as well.""

Exit Theatre Mode

I say ""some customization"" because I'm not here to advise others to try. There"
0.031068259850144386,0.00010080710490001366,0.000553628895431757,0.00025881428155116737,0.0015800677938386798,0.0003678871726151556,"You're a realist.

No one likes a person that's just a fan.

You're one of the best at sports that you know how to compete against.

Well, that's what's been happening with you."
0.0018150476971641183,9.588208922650665e-05,0.00019579041691031307,0.00012979954772163182,0.00022657582303509116,0.00016208320448640734,"You're a real gamer. A gamer, and as such, it's very important we take the opportunity we take to improve your game. We are dedicated to teaching our players everything they need to know, from how to interact in games to how to"
0.4887668788433075,0.0003746466536540538,0.008787889033555984,0.0006161744240671396,0.026702910661697388,0.0018225142266601324,"You're a realist! I think that saying no to a woman's hair is probably just as sexist as saying, ""I don't care about the hair. It's a natural part of the person that I love. Don't mess with that"
0.011218671686947346,0.00010223558638244867,0.0003197637270204723,0.00020043557742610574,0.0007450126577168703,0.0003073311527259648,"You're a real hard worker but you also have money, like money that's worth more to you than you spend.

As a person, if you work hard, you're gonna improve your life, but people will only do it when the"
0.025777777656912804,0.00010170245514018461,0.0005976947140879929,0.0002433611371088773,0.0013591335155069828,0.00030426992452703416,"You're a real man, and you've put it into your body in so many ways, what could you have possibly asked for when it came to this?"""
0.04049651697278023,0.00011807322880486026,0.0007835059659555554,0.0003461494925431907,0.0020455459598451853,0.00041329776286147535,"You're a real man.

(Sound of water running through the grass. Some kids are playing and the kids are playing, but I hear footsteps behind me.)

(I hear the girls coming into the room and the girls are coming"
0.005225390195846558,8.953706128522754e-05,0.0003081961185671389,0.00014463781553786248,0.0004081090446561575,0.0001864590449258685,"You're a real life person,"" he said, adding, ""What do you say? Don't you want to come here?""

She smiled slightly. ""Thank you."" She turned to look at the door. ""Who are you, Mr"
0.0009858442936092615,0.00011720141628757119,0.0001750964147504419,0.0001598988164914772,0.00019903220527339727,0.00016411408432759345,"You're a real man and I want to do the things right for you.""

Mr Abbott made the remark when he was first interviewed by Mr Cameron. The Prime Minister said she was ""totally at ease"" with the comments.

"
0.011689048260450363,9.724050323711708e-05,0.0004371974791865796,0.00019377755234017968,0.0009181826608255506,0.0002585116890259087,"You're a real genius, Mr. White.

You're a real genius, Mr. White. You are a real genius.

You're a real genius.

You're a real genius.

You're a real"
0.01583356410264969,0.00011514026118675247,0.0005426834104582667,0.00034718672395683825,0.000909932074137032,0.00031789648346602917,"You're a real human being. You're not making me into a human being, you're making me into something that's like a real human being.""

""Well, I suppose I should be grateful for all of that,"" I said."
0.0009751762263476849,0.00010009502148022875,0.00016921073256526142,0.00011204482871107757,0.00018997446750290692,0.00014248442312236875,"You're a real estate developer. And a real estate developer, I'm not saying it's good. People who understand the market need to know that.""

The study also found, however, that ""there is an increasing number of high-"
0.5145381093025208,0.0007651435444131494,0.03734283149242401,0.0007511767325922847,0.05232367664575577,0.0027393000200390816,"You're a real boy, don't you think?"" The younger girl turned and took off her pants and panties. ""What's your name again, Harry?"" Harry grinned as his friend gave him a look. ""The Granger-.""

Harry"
0.0006860985304228961,0.00011741059279302135,0.00017512279737275094,0.0001325398770859465,0.00017976864182855934,0.00014336194726638496,"You're a real fan of his and will be taking some time off from work to attend the NFL Draft.""

""He has a good eye. We're looking forward to playing in his hometown."""
