toxicity,severe_toxicity,obscene,threat,insult,identity_attack,text
0.9830439686775208,0.027552692219614983,0.777225136756897,0.0011870593298226595,0.8921059370040894,0.015540262684226036,You're a real idiot. Don't be like me. You think this is how our race works. It's your country. It's yours. You're not gonna accept any of the crap on the Internet or on TV. Don't be a
0.07357294857501984,0.0001281706354347989,0.0014126282185316086,0.00035588466562330723,0.003785256063565612,0.0005273866700008512,"You're a real gamer… the real gamer is someone who can do well… and they don't care what they're told. They won't let you tell them anything.""

The game, which has become a big hit in North America since"
0.09295079112052917,0.00013286457397043705,0.0010381221072748303,0.00046755396761000156,0.0032506724819540977,0.0007143190014176071,"You're a realist.

You read my book when you read something that is going to change your world.

You don't like that it's just another day at work?

It's not true!

I was"
0.002665271982550621,0.0001006487145787105,0.0002622168103698641,0.00015093208639882505,0.0002596189733594656,0.00017345977539662272,"You're a real guy and you should try to be nice to each other,"" she said. ""So we've got to come out of that hole where we came from and we have to help each other."""
0.0018710268195718527,9.347185550723225e-05,0.0001868001709226519,0.00012987543595954776,0.00023198018607217818,0.0001636067609069869,"You're a real hero, but the government isn't doing so."""
0.05934089794754982,0.00013603024126496166,0.0016019250033423305,0.0004078471683897078,0.00241684983484447,0.0003817851247731596,"You're a real world citizen and you don't have any kind of privacy rights, right?""

""No, you're not. So the fact that a few people in Washington, D.C., are trying to steal your phone—and"
0.986395001411438,0.06991057842969894,0.9452782273292542,0.0011323068756610155,0.8656980395317078,0.0078109209425747395,"You're a real jerk."" He said. And that was then. I'm still a jerk for being such an asshole.

That was when I'd come to that final step.

We'd gotten into a car. My mom drove"
0.0006025404436513782,0.00013191159814596176,0.0001753848191583529,0.0001503932144260034,0.00017361564096063375,0.00014791489229537547,You're a real fan of our video games. Thank you for sharing your love and your feedback.
0.0014398714993149042,0.00011021456884918734,0.00018636076129041612,0.00016066756506916136,0.0002060973783954978,0.0001750087976688519,"You're a real good person. Don't you feel like you deserve to be respected? I think you deserve to be respected, because if you just think of the fact that you've always been accepted and respected, you wouldn't need me to tell"
0.0007675220258533955,0.00010929931158898398,0.00017248535004910082,0.00012037809210596606,0.00018602682393975556,0.0001368130906485021,"You're a real fan of both, I'm sure,"" said Tom Wigdor, 31. ""That's all right.""

Tom Wigdor and co-founder Ben Green also sat down with Wigdor's wife, Joanna"
0.9617359042167664,0.033436402678489685,0.8730290532112122,0.001337023451924324,0.8466969132423401,0.014566580764949322,"You're a real asshole. So you've got some beef with me here.""

A quick glance of hissed in Snape's direction and he found himself gazing back down at Malfoy.

""You were joking. But how many days is"
0.016412466764450073,9.739233064465225e-05,0.0005902014090679586,0.00024081960145849735,0.0008597288397140801,0.0002738733310252428,"You're a real man, I'm sure. But I guess they take care of it."" And he went on, ""When I was a kid there weren't many kids there who could do that to me, didn't they? Because when you"
0.9349979162216187,0.004528165329247713,0.13640058040618896,0.0009702417883090675,0.8024901747703552,0.006969967857003212,"You're a real loser.

Don't worry about that."
0.05485382303595543,0.0001142489054473117,0.000795527477748692,0.00037494482239708304,0.003381584072485566,0.0004544725234154612,"You're a real person.' Now I know that when I was 10, I started to look for a therapist.

Q: You're a doctor and you've seen more than a few different psychiatrists. How'd that come about?

"
0.0012078189756721258,9.841984865488485e-05,0.00019641118706203997,0.00012176450400147587,0.00019984265964012593,0.00013662769924849272,"You're a real hero, that's why you play as the champion. That's why you play to win, and that's why you've built a whole brand of great hero.""

The following is the full interview, broadcast live Feb."
0.9464902877807617,0.020337264984846115,0.7209150791168213,0.0009169289260171354,0.8724304437637329,0.011915139853954315,"You're a real jerk,"" said Gwyneth Paltrow. ""You're the last person I'd expect to be a jerk around here.""

She paused as she said, ""It is not unusual that I get a lot of push"
0.08450998365879059,0.000318636535666883,0.0012151059927418828,0.0041355350986123085,0.0022657508961856365,0.0012476417468860745,"You're a real man, and you'll be fighting back."" It turns out that the only way I ever would be able to win the duel is if I just kept the focus. I don't know how long I can last, but I do"
0.5902649164199829,0.003055859124287963,0.4483378827571869,0.0010129102738574147,0.1000640019774437,0.001855467795394361,"You're a real artist and I think you could probably do the same thing, what with all the cool shit that you are about,"" S.O.A.P. said. ""How about I get some pictures for you and let's take"
0.0006257196073420346,0.00012508046347647905,0.00017579534323886037,0.00014265273057390004,0.00017889794253278524,0.00014485380961559713,"You're a real star with great friends and great dreams. I've seen you in the press and seen what's happening in the industry. Do you see the potential for this generation?""

""This is definitely something that we all want, it"
0.9965625405311584,0.19124861061573029,0.9773459434509277,0.0017541233683004975,0.9392025470733643,0.013536961749196053,"You're a real human being. Not an asshole, but the asshole you are.

I am an artist, my art is yours, your work belongs to me. Be a fucking artist. Do not feel entitled to fuck with anyone, because"
0.8345332741737366,0.0017803844530135393,0.05088987573981285,0.0007872963906265795,0.547605037689209,0.009373677894473076,"You're a real loser? Don't you think that will give you the creeps and not only take your job back at the White House? We have the real estate market out there, we have the people that love our country that love us, we"
0.007547059562057257,9.192250581691042e-05,0.00032830057898536325,0.00018738923245109618,0.00048314552986994386,0.00020696029241662472,"You're a real person; you've been here your whole life. You're trying to figure it out. ... If you can do everything with no regrets, it will be easier for other people. I don't think the world needs to wait for"
0.0005595429101958871,0.00013381574535742402,0.00020106014562770724,0.00013601598038803786,0.0001828255335567519,0.00014462912804447114,"You're a real deal. Thank you."""
0.0027558475267142057,0.00010595728235784918,0.00029986296431161463,0.00012827762111555785,0.00022036649170331657,0.0001692060468485579,You're a real fan!
0.0019491248531267047,9.669606515672058e-05,0.00019723635341506451,0.0001397824817104265,0.000235926519962959,0.00016747330664657056,"You're a real good listener. And you're in a great mood.

Advertisement

Advertisement

—

I know you're very funny.

You're the perfect comedian.

The last thing I want is to"
0.0018130815587937832,9.295737254433334e-05,0.00018776250362861902,0.0001281320146517828,0.0002353289455641061,0.00015941729361657053,"You're a real life character, but when we get past our first few months we start to realize it's not just a matter of character. People can be pretty angry with you for what you've done. There's a place for that in the"
0.0016047048848122358,0.00011135802924400195,0.0002351701259613037,0.00015889811038505286,0.00022359323338605464,0.00017491319158580154,"You're a real guy now. You're going to talk to her. Tell her you love her."" ""Yeah. That can't be happening."" Yang said, her voice thick with emotion, as if she wanted to feel good about herself. """
0.986434817314148,0.0712156593799591,0.7946808338165283,0.1084035336971283,0.886870265007019,0.07147133350372314,"You're a real jerk, the person I'm talking about isn't your boyfriend.""

""You don't wanna get raped by a random stranger,"" Emily retorted incredulously.

""You just wanna do me a favor and take my"
0.0020413226447999477,9.220379433827475e-05,0.00025291077326983213,0.00010933401790680364,0.00022738176630809903,0.00015329685993492603,"You're a real deal. A real deal. If the NBA wanted more time to really get their ideas into the game, they could have actually done something about LeBron James. I'm sure you didn't get an NBA team without Dwyane Wade"
0.8002768754959106,0.0020899781957268715,0.14484034478664398,0.001624458935111761,0.31078270077705383,0.0045270370319485664,"You're a realist in my opinion.

""What else do we need?""

""Well, this is all important for you, man. And because you're so good at making me look like an idiot, I'm going to"
0.059081535786390305,0.00013586781278718263,0.0019294434459879994,0.0003283581754658371,0.0026188117917627096,0.00045112657244317234,"You're a real, live DJ!"" -- Paul Joseph Watson

Sean Paul - Slap Trap

by iPromote4Free

Reggae"
0.04650266468524933,0.0001301735028391704,0.0005414129118435085,0.0004958439967595041,0.0017522674752399325,0.0009879133431240916,You're a realist. A genuineist. You're the epitome of the realist. And you want to live according to the dictates of that worldview. That is why the Supreme Court had us. We believe in the rights of every American
0.04961460456252098,0.00011175800318596885,0.0007651271880604327,0.0003458997525740415,0.0027205816004425287,0.0005518334219232202,"You're a realist. I've never seen you before on TV.""

The new trailer, titled The God Delusion, is actually very nice. I like to see the Bible used in stories. I like to see an action movie made"
0.006740981712937355,9.579764446243644e-05,0.0004190536274109036,0.0001328164362348616,0.0005165018956176937,0.0002081020356854424,"You're a real deal, isn't it?"" he asked. ""You're really like a supermodel.""

""Yeah,"" said Emily. ""You're going to say that a lot of people don't know how to call you, but"
0.35366618633270264,0.0005800513899885118,0.008687948808073997,0.0007757136481814086,0.01866152323782444,0.009765280410647392,"You're a real man, don't you think?""

""I don't want to be a man. It's just that I'm scared of women.""

A good chunk of the time they are just trying to keep men off the"
0.635893702507019,0.010426221415400505,0.06422368437051773,0.004104195162653923,0.164439857006073,0.47618207335472107,"You're a real black man. You're white.""

Trump: The media isn't trying to do the right thing. It doesn't mean they aren't right. They're saying some things. They just don't believe the facts. You"
0.0097139747813344,9.532961121294647e-05,0.00037567183608189225,0.00020805539679713547,0.0005440247477963567,0.00024114632105920464,"You're a real gamer.

What you're doing here is doing what you need to do to play the game, and you want people to read and enjoy it. And you need to bring some of that to your life and your people's"
0.005270495545119047,0.0001009672851068899,0.00031212830799631774,0.0001276770926779136,0.00033475185045972466,0.00030929845524951816,"You're a real-life example.""

After the Supreme Court ruled last week that it was the government's obligation to review the legality of same-sex marriages nationwide, the gay rights movement is still in limbo. Proponents of the law,"
0.03651180490851402,0.00011277318117208779,0.0007388857193291187,0.000328506575897336,0.0018269192660227418,0.00039606780046597123,"You're a real good man, huh? You're not a bad person either, and you're good at living your life according to your own principles.

But why is it so hard for you to be a good man when that's the"
0.010577308014035225,0.0001084487303160131,0.0004681276623159647,0.0002617010904941708,0.0006047399365343153,0.0003017005219589919,"You're a real fighter and I'm a big fan of the sport of boxing, and I'm gonna watch this show, right? The show is about the sport, right? I don't know if it's a sport I know I'd like"
0.9306958913803101,0.013085640966892242,0.620771586894989,0.0007515011238865554,0.8253678679466248,0.008869065903127193,"You're a real jerk,"" he says.


""Don't tell me you're lying, that's what I meant."" She sniffs. She does not seem to believe in her boyfriend's allegations.


They both shake their heads,"
0.017082875594496727,0.00010809232480823994,0.0007601843681186438,0.0002735403541009873,0.0008462531841360033,0.00025915479636751115,"You're a real life hero.""

""Yeah? Like, I've been doing that for 30 years.""

""Yeah? Yeah.""

""How many of these are you guys going to get for Halloween?""

""You"
0.009501577354967594,0.00010092271259054542,0.0005228568334132433,0.0001735823752824217,0.0005672945990227163,0.000222367380047217,"You're a real genius. I'm so good at making it sound crazy. It's so ridiculous that I can still talk about it, and it's so ridiculous that I don't even think of it. It's funny that it makes people think"
0.6329319477081299,0.0009989604586735368,0.005230362061411142,0.0016290792264044285,0.07450588047504425,0.04722083732485771,"You're a real person and you're a feminist."" - Anita Farber"
0.006199963856488466,9.747064905241132e-05,0.00047249149065464735,0.00013253343058750033,0.0004862855130340904,0.000193214655155316,"You're a real deal. Let's do it again,"" he told the crowd.


Mackenzie's win comes after an injury-plagued campaign that saw him miss the rest of last season with an undisclosed ankle injury. He has"
0.966782808303833,0.011430866084992886,0.42222312092781067,0.001034849206916988,0.8928477168083191,0.009738320484757423,"You're a real loser."" You can't do it anymore. You're so stupid, that you don't care.


Yeah.


Hanna"
0.9298995733261108,0.012086952105164528,0.7579941749572754,0.001132942852564156,0.39509060978889465,0.00499384943395853,"You're a realist. A realist in some sense. I'm a realist. I'm a realist in some sense. That is to say, I'm not an ass-kicker, I'm not a pussy-kicker"
0.03739098832011223,0.00010070795542560518,0.0006174301379360259,0.00027193778078071773,0.001540771103464067,0.00046563983778469265,"You're a realist, you don't always think it's your job to tell what it is and why it's good and what you don't like about it.""

""I am not your customer. I am a customer,"" said the"
0.018707262352108955,0.00010152590402867645,0.0004001790366601199,0.0002469073224347085,0.0007791039533913136,0.0004115594201721251,"You're a realist. You want to believe in the light. You want to believe in something that transcends all other perceptions. You've got to believe in it all in your head.""

In truth, he said, the truth is"
0.04868746176362038,0.00019361040904186666,0.0009390094201080501,0.0013199369423091412,0.0028054509311914444,0.0005550060304813087,"You're a real girl…

""You can go down there with me and you're going to be fine.""

Ohh, well, I was glad you called me that. There you go again.

No, wait."
0.06845960766077042,0.00013046490494161844,0.001217573881149292,0.0004534683539532125,0.0034797578118741512,0.0004096506454516202,"You're a real person, and I'm not some crazy guy.

[MUSIC]"
0.7925055623054504,0.002625920344144106,0.04111729562282562,0.0018116176361218095,0.4254239499568939,0.06474790722131729,"You're a real nerd, so go ahead and use the power of your imagination. I could not stand a little bit of racism, and I really, really didn't like people thinking the way I thought. So here are my rules, and I"
0.4127892851829529,0.00040055150748230517,0.0076619903557002544,0.0005776723264716566,0.11560823023319244,0.0022644405253231525,"You're a real bad football player, you've got a lot of mental scars.

""But you've also got the chance to win. But it's tough, we've all had the potential. But this is the opportunity to make sure"
0.4795776307582855,0.0006336786900646985,0.02499549277126789,0.0008104105363599956,0.1379375010728836,0.0026062303222715855,"You're a real person. You're not a figment of your imagination or your brain.""

Cumulus is proud that he is a true human, able to communicate with millions, if not millions of humans around the world and is """
0.14605116844177246,0.00018958868167828768,0.00148012675344944,0.0006532431580126286,0.013124228455126286,0.0007548349676653743,"You're a real person. You're a good kid. You can get along. You just have to be yourself. You're gonna have to be your mommy."""
0.0009089178056456149,0.00010936071339529008,0.00017766245582606643,0.00013304661842994392,0.00018327026918996125,0.00014755793381482363,"You're a real gentleman and he can do what he wants. Let me finish my speech.""

The speech will be on the House floor and a vote will take place Oct. 16."
0.0008351439610123634,0.00010719570855144411,0.00016765098553150892,0.00011770473793148994,0.0001805290812626481,0.00014486252621281892,"You're a real journalist,"" he says. ""It's a real privilege to get to tell the truth about your side of the story."" He even gets to tell the story, if you so desire.

But when you're interviewing Trump —"
0.0007269653724506497,0.00012160553887952119,0.00016328399942722172,0.00014334007573779672,0.00018375986837781966,0.0001535981282358989,"You're a real artist, and we love to hear how you like your work and how you're improving,"" said Hodge. ""We always try to try to help out as much as possible, in many cases.

""But that doesn"
0.0011299551697447896,9.959612361853942e-05,0.00017774919979274273,0.00011659035226330161,0.0001960891531780362,0.00014567520702257752,"You're a real-time strategy designer, but not quite what you might call a strategy designer. You want to see real-time strategies in action, not some sort of ""real-time"" strategy. Strategy is a very different kind of game"
0.7875769138336182,0.00948269385844469,0.5051587820053101,0.0014431524323299527,0.5809545516967773,0.02459106035530567,"You're a real badass, right?"" The two went on to argue about how sexist they thought sexism was, their respective views on feminism, and why not just go back to the subject."
0.0667053610086441,0.00012461806181818247,0.0011299061588943005,0.0004282188310753554,0.004326561000198126,0.00046460283920168877,"You're a real world doctor, you're a real world veterinarian. A real world dentist, you're a real world sports fan. You've got all that stuff. You've got that stuff. You can do whatever it takes to be a professional"
0.005242966115474701,9.421622235095128e-05,0.0003082049370277673,0.00016040289483498782,0.00035712652606889606,0.00019549473654478788,"You're a real professional"" and ""this is a job that I have to do at this stage"" and it's a job that I have to give to people because I have to make a living, or I have to spend as much time doing"
0.021728960797190666,0.00011910249304492027,0.0007704389281570911,0.00023066721041686833,0.0013741067377850413,0.00031866965582594275,"You're a real girl and I'm sure you're excited to meet you. We'll be meeting after lunch.""

""Yeah. You're sure?"" He turned to stare her blankly. Her face was still flushed.

""H"
0.0009289241279475391,0.00010894728620769456,0.00020328020036686212,0.00011702363553922623,0.00018553594418335706,0.00014180928701534867,"You're a real deal

You think he's the right man. He's an honorable man. He's a great man.

So, the only thing that matters is that the fact he was involved in this is pretty irrelevant. This"
0.0033506478648632765,0.00010528600250836462,0.0002618837752379477,0.00019086939573753625,0.0002857499639503658,0.00019584437541197985,"You're a real person, you're going to be a leader.""

And in that light, I'm sure they'll find a way to make it work.

It's so easy to feel guilty, but what's truly beautiful about"
0.19192001223564148,0.00027534132823348045,0.002469981787726283,0.0020696958526968956,0.00597364129498601,0.0010074869496747851,"You're a real man, huh? Don't tell me you feel your skin going to light up like I was watching a movie? Don't tell me you get angry when people don't want to go out with you or that you want me to"
0.9930993318557739,0.15431055426597595,0.8675985932350159,0.2854311466217041,0.8934106826782227,0.036985546350479126,"You're a real badass, dude!

You're a real badass, dude! Your girlfriend is a real badass!

Your girlfriend is a real badass! You can beat me up, bro!

You can beat me up,"
0.9075555801391602,0.023327955976128578,0.772007167339325,0.0011832955060526729,0.8010408282279968,0.018301649019122124,"You're a real bitch""

""I'm not scared of you."" ―Tony Stark and The Vision [src]

Tony Stark was an experienced businessman, well versed in a variety of subjects. He was a staunch supporter of Civil"
0.0007068669074214995,0.00011634115071501583,0.00018398812972009182,0.00011901462130481377,0.00018899972201325,0.00014116709644440562,"You're a real estate agent, so you understand what I'm trying to tell you,"" she said, before continuing to introduce herself. ""I'm a real estate agent here with a good background in real estate.""

At that point, she"
0.0005905390135012567,0.00012894783867523074,0.00017612872761674225,0.00014488476153928787,0.00018347518926020712,0.0001465593813918531,"You're a real good athlete, and you're on your way. And if you have the ability to play at an elite level, you'll always get the opportunity.""

When asked what he'd like to do differently next year, Hines"
0.019948817789554596,0.00010189183376496658,0.00045030677574686706,0.00023697956930845976,0.0012978912563994527,0.0003790816117543727,"You're a real person, like all human beings,"" he told the audience when asked about Trump's criticism of former Ku Klux Klan grand wizard David Duke in an interview with Breitbart News Daily's Mark Pare. ""There are many people that look like"
0.026687059551477432,0.00010230638872599229,0.0005919060786254704,0.0002552693767938763,0.0012678378261625767,0.0004564949485938996,"You're a realist.""

Bosnian's top goalscorer, who earned a permanent call-up to United on Tuesday afternoon, said: ""This is really a club that really wants to win. I don't know where in"
0.017126301303505898,0.00010102170199388638,0.0005399559740908444,0.00025346092297695577,0.0008751428104005754,0.00026188103947788477,"You're a real person that you are capable of dealing with.""

""I think about every day the same. People's minds are not the same. I think about every single day.""

""The only time you ever felt like you"
0.8099894523620605,0.009116449393332005,0.07811573892831802,0.00682055251672864,0.20589905977249146,0.4253058433532715,You're a real black man. What a terrible thing. My face turns orange. My eyes don't look like that. How could this exist? Are we so bad and you so bad and now you're here with this? I just... What
0.6751003861427307,0.005835430696606636,0.04950244724750519,0.004485392011702061,0.09047070145606995,0.32543620467185974,"You're a realist, you're going to say something, and I'm going to go, ""No, no, not. I'm not a racist."" And when you say, ""Yeah, I know black people, black people were used"
0.029254501685500145,0.00011965219891862944,0.0007882076897658408,0.00045329867862164974,0.0013038166798651218,0.0003744293935596943,"You're a real guy. You don't need to pretend you aren't a real man to be proud.""

""You're going to be here with us tonight. You're going to see if that's the case tonight. And I don"
0.10792485624551773,0.0002467407030053437,0.001732952892780304,0.0017292849952355027,0.003853058908134699,0.0009452569065615535,"You're a real man, I don't care what you look like,"" she teased him. ""I like to live my life with you guys!"" He responded, standing up to walk down the hallway and into the lounge.


Once they arrived"
0.0018770500319078565,9.84323414741084e-05,0.00021190698316786438,0.00013244006549939513,0.0002170399238821119,0.00015942960453685373,"You're a real person, you have to know how I feel,"" Taylor said, as she sat on the back porch of a home. ""I can tell you that, in my heart, I think I'm smart and that's fine.""
"
0.11942334473133087,0.0009490575757808983,0.004335357341915369,0.0008671468822285533,0.018347296863794327,0.032751161605119705,"You're a real gentleman, man."" ―Mabel and Ricky Wigginton [src]

Mabel, an African-American with a well-developed black body, and Ricky, a Caucasian with a well-developed black body"
0.003374650375917554,9.061270975507796e-05,0.00024392725026700646,0.00014461230603046715,0.0002809567959047854,0.00017434523033443838,"You're a real person in this room. And this is the way that the truth is being told.""

This is also one of the key questions that Donald Trump's supporters need to know about his foreign policy plans.

It is difficult"
0.5380204916000366,0.0008716051816008985,0.08148318529129028,0.0006526805809698999,0.04438856244087219,0.0007486537797376513,"You're a real hard worker. Why would you let yourself go?""

""Oh, my God!"" she said.

""What the hell is that?"" he exclaimed.

""No, what are you talking about? That's"
0.0014597011031582952,9.735286585055292e-05,0.00020348439284134656,0.00011834353790618479,0.0002040515246335417,0.00014185825421009213,"You're a real genius and you have all this knowledge. Why don't you just say it!"" She went into a deep breath and pulled out her phone. ""You know why I'm here?"" ""Because I need to tell you about this."""
0.0022332188673317432,9.557136218063533e-05,0.00019669604080263525,0.00012278517533559352,0.00020912880427204072,0.00019725460151676089,"You're a real journalist, what do you think about that?"" And he said.

""You're right. I know I've done something terrible for the American people over the past thirty years. People say you don't understand journalism. I"
