toxicity,severe_toxicity,obscene,threat,insult,identity_attack,text
0.0017769269179552794,9.006009349832311e-05,0.00021678389748558402,0.00011357123003108427,0.00022860561148263514,0.00014768475375603884,"You're a real guy.""

What does this all mean for him?

""I feel great right now,"" he said. ""I've been playing hardball for a year and a half."""
0.0015206055250018835,9.465431503485888e-05,0.00016516509640496224,0.00011987796460743994,0.00020392355509102345,0.00016860532923601568,"You're a real believer in all things science, not just religion.""

""But you still have to learn all that stuff, right?"" You ask. ""You think science will ever have a magic wand to solve the world's problems?""
"
0.08540838211774826,0.00026219108258374035,0.001031935098581016,0.0006046932539902627,0.004682706668972969,0.0061710299924016,"You're a real American!"""
0.005222371779382229,9.083452459890395e-05,0.00024326995480805635,0.00015999245806597173,0.00034729597973637283,0.00021542336617130786,You're a real fan of the new Ghostbusters and can't wait to see what the next movie in the franchise has in store for your family!
0.0006950625102035701,0.00012470009096432477,0.0001845248625613749,0.00014694475976284593,0.00018103448383044451,0.00014957717212382704,"You're a real rock star and I look forward to playing you,"" he said. ""You're really exciting. When we first started the band, I thought we had a great record, and as we got older we started getting better at it."
0.04475979506969452,0.00013930532441008836,0.0009869452333077788,0.0005672454135492444,0.002662364626303315,0.0005473848432302475,"You're a real guy and you should do a better job than this!""

The man was later found dead a short distance away by a group of other men at the same place where the woman allegedly allegedly shot herself. Police arrested the suspects and"
0.0008506689919158816,0.00010875691805267707,0.00016743899323046207,0.00012540313764475286,0.00020008023420814425,0.00014710331743117422,"You're a real good player when you're healthy, because they're able to take care of everybody.""

This is all going to be good for the Sixers. Even though they missed an opportunity by putting the ball in the paint in the first"
0.9935649037361145,0.11863423883914948,0.9682310819625854,0.001570746535435319,0.9115950465202332,0.012573672458529472,"You're a real deal. Go and fuck yourself.""

After a short break at a hotel near a hotel in Shanghai, Li Yixing and his wife, Peng Xiaodong, were waiting in the lobby of the hotel.

"
0.06811252981424332,0.00011716321023413911,0.0009709635633043945,0.00030020478880032897,0.0034217380452901125,0.0007345858030021191,"You're a realist.""

""That's right,"" said Hermione. ""It can be a problem at times.""

Hermione nodded. ""Do you like the way I dress?""

""Of course not,"" said Ron."
0.9966855645179749,0.23995055258274078,0.9852166175842285,0.002241874812170863,0.9314429759979248,0.013213560916483402,"You're a real fucking dick,"" M. asks with a grin.

""Yeah, actually,"" says M. as he takes his pants off. ""We used to call it 'The Best M' Thing You Ever Made.'""

"""
0.0011755398008972406,9.896919073071331e-05,0.0001708574709482491,0.00011390516010578722,0.00019941458594985306,0.00015313790936488658,"You're a realist, so let's all just agree that every single moment has a value. If you take the time to look at the graph of all life's variables, in a specific order, then we can get an idea of exactly how"
0.9946755170822144,0.11712789535522461,0.9538846015930176,0.006456288974732161,0.9387239217758179,0.025795593857765198,"You're a real jerk with a black eye,"" he said.

""Not really, you have no idea. You probably know you have to watch your fucking legs out.""

He continued. ""I know what this can be, but"
0.9219434857368469,0.012764744460582733,0.6408870220184326,0.0008396771154366434,0.8209173679351807,0.007394791580736637,"You're a real jerk…

This is a great one, because I've tried to put my own spin on this. If you want to see me make a video for a free event, don't go there. Don't get me wrong"
0.001306623686105013,9.869513451121747e-05,0.00017209650832228363,0.00012182454520370811,0.00019763941236305982,0.0001579660311108455,"You're a real gamer. Maybe you like action RPGs, or the more casual shooter genre, maybe you just like fantasy, or the more ""romance"" genre, you will like fantasy too, and maybe you like action RPGs or the more casual"
0.6706025004386902,0.001726265880279243,0.020732248201966286,0.002259362256154418,0.07581431418657303,0.07506463676691055,"You're a realist! I know why you're calling me a racist!"" The victim's mom, a black woman who was the target of the attack and ""didn't know what happened to me,"" called police. ""She just ran out of"
0.005969296675175428,0.00011775200255215168,0.0004836390435229987,0.000160618539666757,0.0006714845076203346,0.00021713017486035824,"You're a real, hard working mom and a good wife and you're a good guy.""

Kendall then told the group, ""Let's go over and talk about this."""
0.006168860476464033,0.00011405831173760816,0.00036184111377224326,0.00021272299636621028,0.0005393981118686497,0.00026644207537174225,"You're a real man."" ""Yes."" ""And I'm so sorry for what I've done."" ""I'm sorry for your father. I love you."" - ""You know what that was like."" - ""You were a good little boy"
0.024049770087003708,0.00010339976142859086,0.000652954971883446,0.0003087713848799467,0.0011817800113931298,0.00029953609919175506,"You're a real person! And you know, if you can handle a million people, it will get to be your calling card.""

Trump responded: ""You can handle a million people, what you can handle is getting as many people as"
0.20998769998550415,0.00019080698257312179,0.0018197472672909498,0.0004539185028988868,0.016130562871694565,0.001880829338915646,"You're a realist.""

Afterwards he was joined by an elderly lady, with whom he had an argument on the road. ""I don't want her and I don't like her either."" Afterward he went back to his room"
0.006902259308844805,9.819870319915935e-05,0.00042007071897387505,0.00019705796148627996,0.0003835134848486632,0.00019209027232136577,"You're a real fan of his, too. And now you're gonna have to prove that to him."""
0.14360718429088593,0.0002021651016548276,0.002375026000663638,0.0007914304733276367,0.010744920931756496,0.0007930154097266495,"You're a real man and a real mother. How could you possibly ask anyone else not to want you?""

I look at her again and see her hand gripping the bar beside me. I'm sure she'll understand and she'll tell me"
0.0751001387834549,0.0001263329468201846,0.0009792727651074529,0.00035692707751877606,0.0042450446635484695,0.000765634817071259,"You're a realist."" ""Oh yeah. If a ghost were to say to a girl that is like, 'Why does the moon rise today?' she probably would,"" said Blachner. The professor explained: ""It's easy to get"
0.8214887976646423,0.001612132415175438,0.041283056139945984,0.0006973472191020846,0.5521049499511719,0.005189149174839258,"You're a real loser, right?""

""Nonsense. No, it's you who have no pride in having that pride."""
0.9608208537101746,0.020075621083378792,0.7623322010040283,0.001929517718963325,0.8595048785209656,0.00840290728956461,"You're a real jerk, I've been talking to you to get outta here, don't blame me. No problem. I'll stay.

And so I'm going to the kitchen, it's not like I'll be here."
0.9859607219696045,0.050193239003419876,0.8633930683135986,0.001139111234806478,0.9436728358268738,0.01462840847671032,"You're a real jerk"" and ""You're a jerk and you're going to give them all your stuff you bought because the guy is a jerk.

A: They're not going to give you everything, you have nothing, you can"
0.0006108868401497602,0.00013151309394743294,0.00019834452541545033,0.00013823906192556024,0.0001818836753955111,0.0001474604505347088,"You're a real good friend!"" and ""This might be just the best deal ever."""
0.5822975039482117,0.0006468157516792417,0.013121857307851315,0.0026278544683009386,0.08513867855072021,0.0020168032497167587,You're a real person. Your life is a living hell and I know how hard it is to be loved by some people...but when I came here I felt like this is what I'm getting at here with my life and I'm going to
0.0015336592914536595,9.070313535630703e-05,0.0001758899015840143,0.00010891384590649977,0.0002189934893976897,0.00015522581816185266,"You're a real nice person, but a real nice person doesn't have to look like you.""

And they're talking about people like Donald Trump. But who did he think he was? And who did Trump think he was?

"
0.8820778727531433,0.0030161808244884014,0.08524136245250702,0.0007630668696947396,0.7172828316688538,0.006566789932549,"You're a real loser here,"" he told her."
0.9821233153343201,0.05599575117230415,0.6126992106437683,0.027351854369044304,0.9066531658172607,0.3589218258857727,"You're a real boy, you're gonna see me right now.""

""What the hell?"" yelled the blond haired, tall black haired, lanky Caucasian with glasses.

""You're an idiot, what are you thinking"
0.011156500317156315,0.0001037814436131157,0.0004960345104336739,0.00022440288739744574,0.000599214225076139,0.00024414598010480404,You're a real rock star. You're a real star. I'd like to know why I did it. Where have I got it from? Why can't I go back and find it myself or what? Can't I go to an audition
0.039888132363557816,0.00022709424956701696,0.0008184298640117049,0.002048660069704056,0.0013755130348727107,0.0006891503580845892,"You're a real good guy, but you're also probably going to be in trouble.""

When you are in the midst of an existential crisis, it takes only a few seconds to make up your mind: ""Don't feel bad, feel"
0.035692743957042694,0.00010862859926419333,0.0009424032177776098,0.0002013292832998559,0.0021380006801337004,0.00039527835906483233,"You're a real estate tycoon and I've made a fortune selling houses for tens of millions of dollars. Do you know how much I made in real estate deals?""

The senator asked Trump. ""Do you know how much I made from"
0.08664293587207794,0.00026579457335174084,0.0013604738051071763,0.0008379773935303092,0.003551099682226777,0.005153500474989414,"You're a real hardliner. The last three presidents in recent memory—Barack Obama, Barack Obama—had been so hard on working Americans. And we need to make sure they don't vote because that would be an unconstitutional attack on them."
0.021071868017315865,0.00011399698269087821,0.0005371526931412518,0.00036591183743439615,0.0008272710838355124,0.0003940572787541896,"You're a realist and you're thinking you're going to be able to hold my hand.""

""I don't believe that I ever would. You never tell people what you think they can do, and they will never ask for that"
0.27940890192985535,0.0014007436111569405,0.009199407882988453,0.0030498842243105173,0.014833195134997368,0.07411009073257446,"You're a real person, right? I told you so. It hurts to hear you say that, but let me tell you this: You look at me like you've seen some good black people before me. I ain't only black, I"
0.0037859054282307625,0.00011675857240334153,0.0002963001315947622,0.0002347630652366206,0.0003181526844855398,0.00021295961050782353,"You're a real man!

In the middle of all these questions, I can imagine a smile on one of my eyes.

I think to myself that I would be happy to sit next to you.

Now, as soon"
0.008379320614039898,9.700850205263123e-05,0.0004625114379450679,0.00015047354099806398,0.0004402970371302217,0.00020757431047968566,"You're a real gentleman in here, not like I'm a real gentleman and a real gentleman,"" he says quietly. ""You're a real gentleman in here, not like I'm a real gentleman and a real gentleman."" Then he pauses. """
0.971555769443512,0.08470112830400467,0.23165716230869293,0.7404571771621704,0.561805009841919,0.04265445098280907,"You're a real loser, you get hit, you get robbed, you get killed, you kill somebody. You're just not prepared and you can't move around."" But even if the guy's scared of you, he still wants to get away"
0.09118905663490295,0.00015037658158689737,0.0016835940768942237,0.000536684412509203,0.004594770725816488,0.000584743800573051,"You're a real guy, and this can't just be a random one, like someone stole your car at college or something like that, I've seen someone do it all the time.

""But it doesn't stop, it stops,"
0.0008815834880806506,0.00010932443547062576,0.0001757640129653737,0.00012856796092819422,0.00018225448729936033,0.00014118378749117255,"You're a real world company, and you have to understand the things that they're working on. It's not always easy. It can be difficult to know what works and what doesn't work, and sometimes it's difficult to know what's important"
0.000618571590166539,0.00012200438504805788,0.00017454200133215636,0.00013371932436712086,0.00017515552463009953,0.00014006013225298375,"You're a real good sport fan, and the first game of the season was a chance encounter with someone from a new company. I thought it was the best game I've seen. I don't think my father will ever win an award.""
"
0.10028563439846039,0.00022881495533511043,0.0009460421279072762,0.0005604420439340174,0.005041805561631918,0.006093616131693125,"You're a real American"""
0.002569192321971059,8.655105193611234e-05,0.0001779157028067857,0.00012894292012788355,0.0002930019109044224,0.0001771863899193704,"You're a real man in the kitchen and you're running an empire and you need to be smart about politics. But there's something else going on too."""
0.001320205396041274,0.00010266055323882028,0.0001982206740649417,0.00012906901247333735,0.0001877639297163114,0.00014853735046926886,"You're a real fan! Why don't you do me some favors and tell him you like his show?""

""Well... you know, I know it's funny, but I think you should be a little more lenient. I don"
0.0011823124950751662,0.00010297870903741568,0.0002076412201859057,0.00011578003613976762,0.00019539021013770252,0.00014213866961654276,"You're a real professional."" ""Yeah. Yeah."" And she looked up, at my gaze, and said, ""You can tell me your name."" ""Nah, let me know.""

""Okay.""

I'm still feeling"
0.004722623620182276,0.0001385375508107245,0.0003837218973785639,0.0002789919381029904,0.00036932036164216697,0.00025863025803118944,"You're a real man now.""

""I'm happy we came. I know it's your dream and I love you, but I know now is the wrong time.""

""I'm so sorry that I have to leave this world"
0.0036454135552048683,0.00011490115139167756,0.0002738777839113027,0.00016115762991830707,0.0002902706910390407,0.00027410947950556874,"You're a real nice guy. That's something that you can't say.

AMY GOODMAN: He's also going to say, quote, ""I'm not a Christian. I just want someone who cares about children, who cares about them"
0.9492096304893494,0.02062980644404888,0.7441670298576355,0.0009711869643069804,0.8635761141777039,0.013440117239952087,"You're a real jerk. It's your fault. And, if a guy gets it right he'll always be a jerk.

""I don't even know where to begin,"" he says. ""But we've been on this for so"
0.014262652955949306,0.00010750598448794335,0.0006064229528419673,0.00025319139240309596,0.0007936262409202754,0.00027796972426585853,"You're a real man, and I know I look like a real man.""

He didn't mention that ""real"" wasn't the only possible compliment. In reality, that compliment was almost exclusively directed at Trump, who had made an appearance"
0.044882405549287796,0.0001105029004975222,0.0007716461550444365,0.00035322117037139833,0.0022908486425876617,0.0003582193749025464,"You're a real person, but I've got to tell you that not everyone is a real person."""
0.0007769257645122707,0.00010829805250978097,0.00017900440434459597,0.00011056741641368717,0.0001794083509594202,0.00013628705346491188,"You're a real fan of the original '90s, or you know, maybe '90s, but '60s and '70s music is still more electronic, more hip-hop,"" Sanders told me, adding that the album's lyrics"
0.0034238621592521667,8.856315980665386e-05,0.00023450871231034398,0.00013841000327374786,0.0002974435919895768,0.0001853619614848867,"You're a real person.""

So why was he so critical of Kaepernick during the national anthem?

""I just wanted Kaepernick to say that he stood with the people of the great country. That's why, so much about what happened"
0.014103286899626255,0.00011859409278258681,0.0004666505556087941,0.0002722452045418322,0.0009326937142759562,0.00030847833841107786,"You're a real, solid girl, I've done your homework and all of your kids are perfect.""

""No. No. No.""

Lori started pushing herself up onto her toes. ""I'll just come back to school"
0.42934539914131165,0.0013049477711319923,0.019779352471232414,0.0106304120272398,0.01606578566133976,0.005397855769842863,"You're a real woman and you want to see what happens when we get in that position where we go and take this man off with our heads,"" he says. ""We're a real woman and we want to see what happens.""

"""
0.027432257309556007,0.00011842458479804918,0.000960107718128711,0.00023899791995063424,0.0012070535449311137,0.00030144350603222847,"You're a real genius! I made a list!""

It didn't take long, and by the time I got home, I had put on a pair of shoes and a hoodie, put on a pair of underwear and a hoodie"
0.17262864112854004,0.00021451352222356945,0.0020477527286857367,0.00043645233381539583,0.0241120383143425,0.0017291978001594543,"You're a real boy you've got to be honest... I'm not scared of girls like you are."" Ruby's head snapped open, she saw her friend starting to take in Weiss, the blond looking girl. ""...What kind of girl do you"
0.24125422537326813,0.0009307806612923741,0.002000349573791027,0.025463692843914032,0.011167694814503193,0.0041028582490980625,"You're a real human, okay? I'm not going to hold back.

""But we're all adults now. Just like you are. And we're all alive now."""
0.0016283263685181737,9.359565592603758e-05,0.0001985536073334515,0.0001056171313393861,0.00021212083811406046,0.0001772364048520103,"You're a real American, right?"" Trump tweeted Monday night after the debate. ""But not for me.""

...

In an interview Tuesday with Univision (via Reuters), former Arkansas governor Mike Huckabee offered another argument: ""If Trump"
0.00316307763569057,9.466089977649972e-05,0.00026217882987111807,0.00012290102313272655,0.0002809892175719142,0.00018508768698666245,"You're a real genius! I want you to buy something!

So what do we do?

We sell this product on Amazon for $5 a pop!

You can even buy it in China for $10!

"
0.7776849865913391,0.0048404778353869915,0.5692917704582214,0.0009183055371977389,0.22139358520507812,0.0029298560693860054,"You're a real man. And that ain't bullshit. It's not about the amount of money you make, but what you make. And you made money because your wife thought your best chance to grow up in a family like yours was good and"
0.07466975599527359,0.0001551812601974234,0.0006732447072863579,0.0006937813013792038,0.004461281932890415,0.0007487635593861341,"You're a real artist, you can paint your own work, you can paint on canvas, you can sculpt and create your own characters, but if you don't paint, that doesn't make you an artist, and I think you'll look like"
0.19014468789100647,0.0006828421610407531,0.007221394684165716,0.0008106391760520637,0.046977609395980835,0.015266467817127705,"You're a real black bear, I don't know if you want to think about me or not."" ―Hulk and the Hulk[src]

Hulk's family grew up alongside him in rural Missouri. As a toddler he loved hiking"
0.6370887756347656,0.0008016102947294712,0.007217584643512964,0.002595264930278063,0.11605509370565414,0.01460627093911171,"You're a real, living, breathing, functioning, non-violent individual with a conscience that makes the most sense to you. You are an individual, and you deserve more than a name because you have it all.

I have my own"
0.006474032066762447,9.669080463936552e-05,0.0002575536782387644,0.00020885760022792965,0.00046315157669596374,0.00024356147332582623,"You're a real, living person. You're also a smart person. You know you like to make decisions and make smart decisions and you believe in yourself and you're not judging others by what you're hearing out of you or by what others believe"
0.14963626861572266,0.0001776016433723271,0.0020043489057570696,0.00042407569708302617,0.013365210965275764,0.0007058850605972111,"You're a real human being."""
0.027000166475772858,0.00011782297951867804,0.0006627027760259807,0.0003064942720811814,0.0018535454291850328,0.00045462785055860877,"You're a real human being.""

That's what the police said and they were right.

""I just want to say to everybody. This happened to one of the most vulnerable people we've ever met at the hands of police,"
0.02970001846551895,0.000123609381262213,0.0008890911703929305,0.0002924295258708298,0.001615585177205503,0.0003732017066795379,"You're a real, grown man. You know that,"" she growled, looking back over his shoulder as she watched him fight his way through the room.

""I did. Not enough. But I was, and I did it all"
0.7025749087333679,0.0016974775353446603,0.04319610446691513,0.000947907567024231,0.5103602409362793,0.00794527493417263,"You're a real life gamer, but you might be a huge nerd and you'd like a hobby. How about you?


I've always wanted to play the Super Smash Bros game, and when you say I want to, people seem to"
0.0023347195237874985,0.00010058174666482955,0.00023207619960885495,0.0001577823713887483,0.0002173265238525346,0.0001712696539470926,"You're a real good listener, and this is gonna get your attention.

Don't make these excuses.

Listen, I'm here so that you know where I'm going.

I'm telling you right now that I don"
0.014153392054140568,9.953791595762596e-05,0.0005036559305153787,0.00025757556431926787,0.0007270782953128219,0.0002450239553581923,"You're a real person, too. You have some talent. But I'm a real person only if you can see. But I just can't play a game."""
0.0016056600725278258,9.748170850798488e-05,0.00021030916832387447,0.00011371817527106032,0.00019187317229807377,0.0001497027260484174,"You're a real big fan of it!"" And when the new ad arrives on its Web site, a new ""Ask Me Anything"" segment is about the ad itself, and you don't have to take too many questions. You can answer anything you"
0.9865575432777405,0.03883719816803932,0.7573505640029907,0.008239042945206165,0.9092789888381958,0.007638897746801376,"You're a real jerk."" And then the next morning her face crumpled open in a heap."
0.03668205067515373,0.00018293557513970882,0.0008472250192426145,0.001268347492441535,0.0024339130613952875,0.0006710357265546918,"You're a real good kid!"" she tells him. ""I'm gonna turn you in like one day, so I can show you the best thing about life. I think all the time you've got to take care of your own business."" He"
0.9930517673492432,0.10654316842556,0.9601565003395081,0.00228151329793036,0.9215149879455566,0.012452291324734688,"You're a real bitch. You gotta have some sex with me.""

After his speech, he dropped some coffee to the sound of a thumping on the floor. His voice was so deep and deep that he could barely even put in the"
0.007126025855541229,9.687428246252239e-05,0.0004152348265051842,0.00015509044169448316,0.0005075623048469424,0.0002156697737518698,"You're a real star. How did you get your start in this game?""

He shrugged. ""I never played a lot. I just played. I tried everything. I didn't give it much thought.""

But there's a"
0.5645227432250977,0.0010490798158571124,0.003647149307653308,0.025023018941283226,0.04389374703168869,0.004815251566469669,"You're a real guy, and you probably want to go out and run."""
0.3978201448917389,0.0003660496440716088,0.004921753890812397,0.0011941713746637106,0.02727586217224598,0.005978901404887438,"You're a real believer and not just a liar!

Here's the truth! The only reason Trump is the Republican nominee is because Democrats didn't even like him and couldn't let him go. The only reason Clinton got elected is because he"
0.9549259543418884,0.02112015336751938,0.7634072303771973,0.0008150936919264495,0.8409361243247986,0.010079913772642612,"You're a real jerk!""

""I know I'm a jerk,"" said Lily, her eyebrows raised, as if waiting for some sort of response. ""And you're a grown-up too.""

""You're really so right"
0.9065675139427185,0.012608137913048267,0.6071037650108337,0.0008235548157244921,0.8063872456550598,0.010057821869850159,"You're a real jerk.

If there were a more accurate name for this whole business, it'd be 'macho cheese, onion rings, onion rings, cheese, and a cheese mousse.'

""I'm not sure what"
0.6136465668678284,0.0008302890928462148,0.012322588823735714,0.001466324320062995,0.07358597964048386,0.015380932949483395,"You're a real guy who thinks women will never change. I don't think you can do that. The truth is you should be ashamed of yourself, and just as proud of your body and your mind as you should be of your personality, but"
0.0036742889788001776,0.00010821443720487878,0.0003706144052557647,0.0001312924432568252,0.0002921625564340502,0.00017686787759885192,"You're a real nice guy,"" his wife said before shaking her head and wiping a tear from her eye.

""No, no, I'm sorry,"" her husband said. ""We didn't talk about much until, you know, about"
0.0012369214091449976,0.00010596152424113825,0.000182303148903884,0.0001308686041738838,0.0002152913366444409,0.0001621804403839633,"You're a real, mature, funny, funny, and serious guy. You want me to show you that?"" (Laughter and applause)

""Sure, sure,"" said the girl. ""I hope so. Do you want me to"
0.00090558803640306,0.00010397500591352582,0.00016741279978305101,0.00012592090934049338,0.00020315017900429666,0.0001418701431248337,"You're a real good hockey player,"" he said. ""You don't have to be a great one to play at this level and I think you're a pretty smart one to play at this level.""

In his last season, the Detroit"
